comment,post_dates
"The problem is that Palestinians in the US are getting shot and stabbed and somehow Zionests are yelling out ""oh we're being targeted, oh antisemitism""",2023-11-26 14:30:38
"This breaks my heart, BTV is my happy place and it's disturbing to see this news.  I have been to Burlington MANY times over the years, this is the last place I would have expected something like this to happen.  Gorgeous  town in the mountains on a lake.  This is a VERY liberal college town, Bernie Sanders was their mayor back in the 1980s and he still owns a place up there.  Hoping for peace in the Middle East soon and quick recovery to the victims.",2023-11-26 15:48:45
They really want to wake up those sleeping giants in usa too it seems,2023-11-26 14:00:52
"Seriously, this is now going too far🤬
 So sorry to to hear about it💔💔💔 I hope they will all survive and the shooter get caught soon.",2023-11-26 13:35:16
Have you noticed how this isn't being treated as an active shooter? I scanned through all of the news channels and they're talking about Israel. 3 students were just shot on US soil and there is barely no attention. What the fuck? Where are the helicopters?,2023-11-26 18:10:43
"Zionism breeds psychos 


Islam/Arab phobia needs to end with the horrific rhetoric pushed by traditional media 


I’m so glad Gen Z is awake to Israeli crimes",2023-11-26 17:26:38
"Three smart individuals who got accepted to really good universities, but some trash rat just had to end their lives 🤬🤬🤬",2023-11-26 16:36:06
"Oh look, the same thing that happened last time Muslims were vilified by Western mass hysteria is happening again.",2023-11-26 18:05:42
Remember that little boy shot in Chicago because he was Palestinian?  These kinds of hate crimes are being perpetuated by the genocidal language of those in power and their lapdog media.  They should all be charged with incitement of violence,2023-11-27 02:02:06
victory for palestine,2023-11-27 06:21:56
[deleted],2023-11-26 15:54:34
Now people will shoot you over a scarf. Wtf. This is some extremist bs. Watch the police do absolutely nothing,2023-11-26 13:41:05
" 

In the tapestry of resistance, the Palestinian Keffiyeh weaves a powerful narrative of defiance and resilience. 🇵🇸✊ As more than just a fabric, it stands as an emblem of the indomitable spirit that refuses to be silenced.

Worn with pride, the Keffiyeh tells the tale of a people who endure, resist, and persist in the face of adversity. Its distinctive black and white pattern transcends fashion; it is a visual declaration of solidarity and an unwavering commitment to justice.

Through the years, this iconic piece of cloth has become a symbol of the Palestinian struggle for self-determination and freedom. It's a tangible link to a storied past, a reminder that resistance is etched into the very fabric of their identity.

Whether draped across shoulders or worn with purpose, the Palestinian Keffiyeh is a call to action, urging the world to stand alongside those who fight for a just cause. As we honor its symbolism, let us amplify the voices of those who use it to speak volumes in their quest for a brighter, liberated tomorrow. 🌍🤍🖤 #PalestinianKeffiyeh #SymbolOfResistance #FreePalestine

https://preview.redd.it/hxvgbhcshq3c1.jpeg?width=1024&format=pjpg&auto=webp&s=70550eb9f9030131b09266cba8ae28a91036c890",2023-12-01 14:22:22
"Truly repulsive.

https://preview.redd.it/i9a9htmr0r2c1.jpeg?width=1290&format=pjpg&auto=webp&s=84cb774b85da984cac3f82e874361b588ef27f95",2023-11-26 15:04:31
"Yeah. I’m really disturbed at the persons reply on the /israelhamaswar subreddit bc I know there’s more of them who think that way, and I’m just trying to ignore it.",2023-11-26 14:56:44
Come on it is undeniable that there has been a huge spike in  antisemitic violence towards jews since the start of the war. The thing is that there has been an equally large barrage of hateful violence against palestinians and moslems in general.,2023-11-26 15:15:38
I thought it was Bernie's home town. Unfortunately it seems Bernie Sanders was always a raging Zionist.,2023-11-26 16:52:55
Whom are they?,2023-11-26 19:25:42
Last time I checked one of them will be released form the hospital and the other two are in the ICU.,2023-11-26 14:47:39
"Yeah. Unfortunately, I can’t say I’m surprised.

Many people are also saying “we can’t assume it’s a hate crime yet without more information.” I’ve hit my quota of how much unfairness and hatred I can handle today. I was talking with a friend earlier on how if this was me, a Muslim American in her mid twenties, I still, couldn’t see many of my friends fighting for justice for me. It’s been really eye opening. And honestly, really heartbreaking. I can’t imagine how these kids or families feel. I hope they’re all surrounded by an amazing support system to get them through this.",2023-11-26 18:21:02
"From what I’ve read, they’re all alive alh. And iA they will have a speedy recovery.",2023-11-26 17:02:00
Huh?,2023-11-26 16:03:41
"Wow. People will never cease to amaze me with their stupidity. Any time a black kid is murdered by cops, all they can say is ""bet that kid was going to be  doctor. What a shame."" Or some dumb shit like that. Where is their outrage now?",2023-11-27 14:40:10
that sub was created and being run by Zionists,2023-11-26 15:29:50
"And to add - these are the kind of things being said about Palestinians. And this was on the post about these poor 3 boys shared on the israelhamas sub. This isn’t even the worst of it. It’s sickening and dehumanizing. I can sit here and condemn violence against Jewish individuals. Or any individual for that matter. “Keep up the good work” makes my blood boil.

https://preview.redd.it/sy7bqfc0nr2c1.jpeg?width=1290&format=pjpg&auto=webp&s=87a2d5049218d42ca684ef2e827840c66f7a2658",2023-11-26 17:09:30
Rubbish. Anti-Zionism is not the same as antisemitism. Pls stop trying to frame it as.,2023-11-26 16:50:54
"“Since the start of the war” so you’re referring to October 7th, right? The “war” for Palestinians has never ended. The oppression they’ve faced is clear as day and I’m not going to sit here to prove it to anyone that knows how to use google or read a book. I have done enough of that with people in my life and I’m truly exhausted.

I have a wonderful Jewish community I’m surrounded by, and I am very well aware antisemitism exists. It shouldn’t feel like a competition of who can hurt who more but clearly that’s what zionists want you to turn this into. And THEY are the reason Jewish communities who are facing anti semitism aren’t getting the support they deserve. It goes as far as calling their own people - a Jewish person, anti semitic for showing support to Palestine. 

Anytime something happens to a Muslim individual, people love to bring up “but but.. we face it too.” No one said you haven’t? Why do you have to make it a point to prove it? Pro-Palestinians can acknowledge that their fellow Jewish communities don’t deserve to face a hate crime. At least I can. But Zionists love to justify what’s happening to Muslims. It’s sickening. Can the Muslim community grieve for just a second without comments like this? No. They can’t. Because they “all deserve it and are all terrorists.” NOBODY will call the guy who shot these 3 innocent boys a terrorist. But if it was the other way around, you know exactly how that would go already.  

I truly don’t even know what I’m saying anymore. None of this probably made sense and I’m just over the obvious disregard towards Muslims. Im not necessarily coming at you in this OP, but it’s comments like the ones in the screenshot above, that take away from Jewish people who are actually facing hate crimes because of the Zionists being psychotic.",2023-11-26 15:41:10
"well as far as I know so far for the pro Palestinians attacks : one little kid was brutality stabbed to death, one college kid was thrown from balcony ( although officials say it was suicide) , and two guys got shot and seriously injured ( hope they make it ) , while on the pro Israeli side one girl was shot outside the synagogue ( officials say the gun shot was by mistake) , so you tell me",2023-11-26 15:28:45
Both would be acts of antisemitism. Stop being racist with how you gatekeep that word. Palestinians are mostly semites.,2023-11-26 18:12:22
"Where..? Where are the murder victims? Tell me, because I’m dying to know",2023-11-26 19:53:01
">a huge spike in  antisemitic violence

I see a lot of people say this, but don't know the source for this information.  Usually, in the US at least, the FBI tracks these statistics and they publish every year. I know there was a 20% increase in 2021. Oddly though, in that year it was only the 4th most common attack behind, anti-black, anti-white, and anti-gay.",2023-11-27 12:49:18
"Considering he's Jewish, he's made some statements in support of Palestine.",2023-11-26 17:09:58
Last I heard it wasn’t declared a hate crime yet. They’re not even trying to hide the double standard. I bet they’re interrogating the guy trying to spin it.,2023-11-27 03:35:21
Found that out very quickly when I went to look at the other posts and it was traumatizing lol,2023-11-26 15:41:41
Yeah the last comment was fucking revolting honestly I think they need to be in Gaza and know how it feels,2023-11-26 23:23:36
I truly love your comment.,2023-11-26 22:59:17
"To add to the attacks on Palestinians in the US: the fatally stabbed child’s mother was also stabbed multiple times in the same incident, last I heard she was alive in serious condition",2023-11-26 19:12:42
"Tell that to ppl over at r/Israel. You support Palestine, your automatically antisemetic. You point out that both are semetic peoples, they claim you are trolling by speaking about semantics. Good grief.",2023-11-26 18:36:37
Any other page that has the word Israel in it is mostly filled with Zionists that spread the most ridiculous propaganda,2023-11-26 22:34:44
"Thank you. I truly appreciate this. It just infuriates me how people try to say Muslims have hatred towards Jews and that it’s, ""in our Quran."" If they knew anything about the Quran, Allah wants anything but hatred toward anyone, let alone because of their religion. [The only time you are allowed to “fight” is when it comes to defending yourself.. and in the case of Palestinians, they’ve had to defend themselves since Israelis arrived into their land.](https://www.tiktok.com/t/ZT8fU6GcR/) Fun fact, a Muslim man can marry a Jewish or Christian woman. If our religion’s sole purpose was to hate any religion but ours, why would that even be the case? 

It’s all just bogus and what Muslims have faced time and time again. Honestly, the anxiety and fear I feel now is 10x worse than when Trump was elected. Which was pretty awful too. You might already know some or all of this stuff but maybe someone else will learn something new today.

Anyways, thanks for taking the time to read my lengthy reply. I hope you have a good rest of your day/night, wherever you are ❤️.

Edit: linked the verse of the Quran.
Edit 2: following the translations of the Quran can sometimes be a bit difficult, especially in cases like this one where it’s not the full verse. Anyone who wants more of an explanation should definitely visit the islam subreddit because those users do a much more better job at it than me",2023-11-26 23:32:37
"And yet, many will use anti-semitic semantic arguments to deny the ""jewishness"" of anyone who dares speak ill of the Zionist pogroms.",2023-11-27 13:39:41
He looks like his mom. How dare they say this is a doll,2023-12-01 14:34:18
The people who believe this bullshit are so fucking disgusting and barbaric. I cried when I saw this baby because I’m a human being,2023-12-01 13:43:13
"Do they not know what a fucking dead baby looks like? Dead babies look like dolls. Common fucking knowledge. Funny how they don’t know what a dead baby looks like and yet they claim Hamas has killed thousands of Israeli infants. Hmmmm.

Rest in peace Muhammad. I’m sorry that this world failed you. Now you will be in peace in the next world.",2023-12-01 14:38:59
What do they need dolls for? IOF has no shortage of apartments to destroy and an equivalent ratio of civilians to kill. There is plenty of evidence of dead civilians being pulled from rubble. No need to fake children.,2023-12-01 13:40:36
"The Zionists are dirty scum. Ask them to take a DNA test to find out where they're from.

They find an excuse for EVERYTHING. Keep using the terms Genocide, apartheid and Israeled.",2023-12-01 14:01:01
"Its disgusting tbh
Imagine trying to gain pity while doing this bs

Even the israelpalestine sub is filled with these zion*st azzhats

Hell awaits these waste of flesh",2023-12-01 14:19:43
"Dead children look eerily similar to dolls. Their skin starts to look waxy somehow, its hard to describe even in my native language.",2023-12-01 15:52:11
Zionist  are Barbaric savages evil murders monsters,2023-12-01 14:24:57
There will come a time when a Jewish person will bring up the European Holocaust and what’s happened in Gaza and the West Bank will immediately come to mind. This is what Zionists will have achieved with their genocide and ethnic cleansing of Palestinians.,2023-12-01 16:04:22
Animals ! The Zionist will pay for it all of it !,2023-12-01 14:13:50
"It's worth noting a  Zionist (Liberal or far right) actual emotional reaction to this would be feeling duped that isn't an actual Palestinian child's corpse, followed by relief when they realize it isn't a doll.",2023-12-01 15:58:19
"Let me get this straight... you drop several times the explosive power of Hiroshima on Gaza, and then tell me the casualties aren't real?",2023-12-01 18:00:02
I mean frfr WTF. God Got a place for the Zionists who keeps justifying this lack of humanity.,2023-12-01 14:15:26
Those fucking Zionists are dirty scumbags. They are one of the most two-faced people I have ever heard of. May Allah SWT curse them,2023-12-01 14:36:00
Fuck Israel forever.,2023-12-01 19:58:46
Rigor mortis. I was more questioning if he possibly died of shock,2023-12-01 16:25:03
Someone please report it in Twitter fact checks,2023-12-01 17:40:48
"I mean they are just projecting with the amount of lies, propaganda and made-up stories they make.",2023-12-01 18:13:07
he has his mamas eyes ❤️,2023-12-01 19:08:10
"Dehumanizing and obfuscation is rule #1. Good guys don’t kill Babies, and they want to be the good guy in the movie. So, it must be a doll. Same thing they do in the US when African American complain of poor treatment. “They are exaggerating” because, the perpetrators style themselves as the good guys in the movie, and good guys don’t savage people because of their race. All stems from the same psychology.",2023-12-01 15:05:45
"&#x200B;

https://preview.redd.it/2fx90rator3c1.png?width=4861&format=png&auto=webp&s=0b3f9143d1a90621fb74b97562b22280508f3cdb",2023-12-01 18:24:39
"Hell nah, I once saw someone open a small casket at the cementary with a baby in it... the skin looked exactly like this. That was years ago and I still remember. That was the first time I saw a dead body. I remember a lot of people whisper, ""looks like a dool"" too. 

After that even family members that died, I didn't want to see them for the last time like that. I rather remember them happy and alive. 

This is so sad. The baby most likely has a day or more dead.",2023-12-01 20:10:19
The baby is a spitting image of his mother.,2023-12-01 17:45:09
😭😭😭I'm so disgusted of these motherfuckers,2023-12-01 16:36:20
They didnt see a single dead person in their life thats why,2023-12-01 15:05:14
[removed],2023-12-01 20:31:08
This claim by Israel is so bizarre and callous it doesn't deserve even a basic repudiation.  It's a hate crime to torture your victims like this.,2023-12-02 04:06:29
Crazy that people can spread that kind of fake news... I wish we can sue individuals for this. Dam,2023-12-02 05:56:21
I thought it looked like a doll at first too but didn’t think at all that they were lying. The babies eyes are so big it’s a little surreal. Rest in peace to the little one. And the baby does indeed look like his mother. No denying they have such similar eyes and nose.,2023-12-02 10:32:23
"That baby has his mother's face

This is not a doll and the fact that anyone would expect something more gruesome to look at than this, therefore it must not be real, is very telling!",2023-12-02 10:42:06
"The disgusting Israeli magazine deleted this article, offering no apology. 

Zionists cry about ""atrocity denialism!"" when sane people can not just simply accept their unproven narratives about Hamas, especially not when Israel has a very long track record of lying in the most outrageous ways. 

Yet they're too comfortable engaging in ACTUAL atrocity denialism. Even when the atrocity *is* undeniable. 

Shameless depravity.",2023-12-02 12:10:27
"I genuinely wonder how people can still stand with Israel. I stood with Israel before I saw the pure destruction and genocide theyre committing. I stood with them before I realized how corrupt they are and how they’re all psychopathic liars. Now I see what they’re doing to innocent people and CHILDREN and I can never understand why people choose to stand with someone who does these things after seeing all of their destruction. To Palestine, I’m so sorry I was on Israel’s side at first, but now I understand what genocide they’re committing to your people and I cannot begin to fathom what it’s like. I’m so sorry that so many people are still supporting the genocide of your people, it’s sick and psychopathic. I don’t know how people look at what Israel is doing and think it’s right, how do they not see what they’re doing? Or maybe they do, and they just want destruction. Either way, it seems Israel has completely forgotten what genocide their people went through years ago, and now they’re doing the exact same thing. I’m so sorry. Bless Palestine. You will be free.",2023-12-02 16:41:16
As if it couldn’t get any worse. Imagine how those mothers must feel to hear their MURDERED children be referred to as dolls???,2023-12-02 20:00:42
The Israelis wouldn't know what a dead 5 month old looks like because no one is killing their babies.,2023-12-04 14:18:39
Wow she really does. It's pretty sad all around but I didn't notice that. Look the same for real,2023-12-01 15:26:21
I didn’t know this and I wish I didn’t.,2023-12-01 16:22:45
"They probably don't - having lived privileged lives, much of their ""victimhood"" now 2nd hand experiences at best but still potent shields for them to get away with inhumane actions, unlike supposed Palestinian ""human shields"".",2023-12-01 19:48:15
"That's what i was thinking they are trying so hard to find the tiniest thing and it's not even what they claim maybe they should educate themselves a little about Pallor mortis, meanwhile they are bombing several locations endlessly, last time i checked 178 people martyred after the truce ended.",2023-12-01 14:17:19
They can't. DNA tests are illegal in Israel.,2023-12-01 18:38:48
"it does look a bit uncanny, but there are a ton of weird little details you don't really see on dolls- like the way his nose has a little cleft on the tip; the little ridge on his gums; the sclera of the eye; the ghostly, vacant expression that wouldn't really be appealing for a child's toy... if it's a doll, it's an incredibly realistic doll",2023-12-01 18:56:44
Yup holocaust industry and its consequences,2023-12-01 16:25:47
"I truly hope this is happening somewhere. I hope all the murdered children are now in God's loving embace, unburdened by the trials of their lives in Palestine before. Did anyone see the one with the little boy that says ""this is not a life?"" He was right. Terrified and hungry all the time, forced to death march down the ""humanitarian"" corrider, watching your family members get killed? I just can't imagine how people continue on. 

And now another post is making me cry. Damn, I gotta get tougher if I'm gonna continue modding this sub. 

Anyway, beautiful artwork, it really moved me.",2023-12-01 20:17:22
No Zionist Propaganda/Hasbara: Focus on Relevant Discussions. Refer to the rules for clarification.,2023-12-03 00:11:11
"It’s a very sad reality :( 

Sometimes deceased adults can look like mannequins/dolls as well, but babies (especially a baby as young as the one in this post) tend to ESPECIALLY look like dolls due to the fact they have hardly any wrinkles, hardly any visual pores (if at all), and of course— no apparent signs of aging on the skin. So when the baby goes into pallor mortis— an early stage in the decomposition process in which blood pools to the place in the body with the heaviest gravitational pull, such as the feet of somebody who has died by hanging, for example— and that blood no longer circulates, causing the corpse to appear pale with little to no variation of color to the skin. Death also causes the eyes of the deceased to become glossy, another characteristic similar to that of a doll. When you put all of those traits together, you unfortunately are left with a baby’s body that looks eerily doll-like.",2023-12-01 17:37:06
Seems everything they’ve accused Palestine of is actually stuff THEY did.,2023-12-01 22:10:17
They are too privileged to see a dead baby. And just shaking in their shoes in their safe apartments while they commit a genocide.,2023-12-01 15:33:57
Are they really?,2023-12-01 21:48:44
"I was referencing the non-highres pictures there. With better resolution it becomes more obvious that these are in fact dead children. But I can see how a person who has never seen a dead child can believe the vicious lie that these were dolls in the low resolution pics. But I can say from first hand experience (thank God non violent) that dead children at first glance do look a bit like dolls. It's uncanny to look at dead children, they look wrong in a weird way that I can't describe.",2023-12-01 20:24:05
"Because it is lol… the longer this goes on, the more it shows",2023-12-02 00:05:57
"Yes, you need to be approved by the government, but it’s not an easy process from what I’ve heard",2023-12-02 00:06:45
Anyone physically supporting this genocidal regime should be trialed in the Hague.,2023-11-14 15:21:39
"*This* is the entity that the US gives $3 billion to every single year.

The US doesn't negotiate with terrorists. They wait on them hand and knee.",2023-11-14 17:05:47
The most amoral army. They keep forgetting the “a”,2023-11-14 14:31:42
More like the most evil and vile army in the world. Spawn of Satan.,2023-11-14 17:23:49
For anyone who will say it's not the same guy or not the full picture here is the [Link](https://twitter.com/QudsNen/status/1724511307955650955?t=1DqsmmwmHaYlijvCDam4AQ&s=19),2023-11-14 16:23:03
"IDF after taking photos with the Palestinians:-

![gif](giphy|14u6vffnoL7tzq)",2023-11-14 23:34:48
"This is what they call a “HuMaNiTaRiAn pAuSe,” literally abuse of power, it’s mentally sick behavior at a (so called) govt. level.",2023-11-14 21:45:13
Please tell me this is not real,2023-11-14 19:19:30
"Unfortunately, they are quite UNSTOPPABLE at this point since no leader of a powerful nation is speaking up. There needs to be something done!",2023-11-14 21:00:14
[removed],2023-11-15 00:18:47
tomorrow IDF will claim that it was HAMAS and if you question it they will call you a Nazi.,2023-11-14 22:21:54
Victory for Palestine,2023-11-15 07:04:46
The worst part of politics is that you can't really decide which side to trust,2023-11-15 05:18:06
"[https://www.facebook.com/100022948355060/posts/pfbid0bJBxWzCnG9t5CZg2QmfnYXyDdGLKXVm52K5QbwzDTQE6VRGdmMbCVwKxSiyGufkjl/?app=fbl](https://www.facebook.com/100022948355060/posts/pfbid0bJBxWzCnG9t5CZg2QmfnYXyDdGLKXVm52K5QbwzDTQE6VRGdmMbCVwKxSiyGufkjl/?app=fbl)

https://preview.redd.it/0ul42f720j0c1.jpeg?width=1280&format=pjpg&auto=webp&s=27065683add60ae08dfde464063890c6a5ab5134",2023-11-15 09:58:06
"Idk if you notice, it's getting harder to justify. They stick to the same excuses and get mad if you insist on the inhumane and immorality of all of it.",2023-11-14 19:53:18
I just read that 99.7% goes into their military. I keep telling people and I believe that once the boomers are gone. Israel is going to have a rough time getting that support. At least I fucking hope,2023-11-15 02:23:32
New link its gone,2023-11-14 18:11:09
"It is. There's been a few soldiers or ex soldiers that spoke how they would tell them they all left but would still find people in the neighborhoods. They would treat them nice, give them food and water... then left and bombed the place.",2023-11-14 19:55:36
"United we stand. Do what you can, when you can. Follow and trust your conscience. Solidarity ✌🏼",2023-11-15 02:04:40
"We have the word of his own family.
The man in the first case was named Bashir Ibrahim Hajji/Hejji/Hijji (phonetic translations to English may vary). He lived in the Al Zaytoun neighbourhood in Gaza. That'll be enough to find some stories, but if you're waiting for CNN or the BBC to report on this, you're going to be waiting a long time.",2023-11-15 01:46:58
"You came to the wrong place to shill this kind of unprincipled, both-sides nonsense.",2023-11-15 06:51:26
"They’re just resorting to censorship and name calling at this point lol, anti-semitic this and that. Fuck it even thinking is anti-semitic! Not like some of us are fucking Semitic or anything.",2023-11-15 01:23:32
