comment,post_dates
"I hope so too. But when the hell are we ever gonna get rid of them? The past few presidents have made it clear that there needs to be maximum age for the presidency, and yet the old farts keep getting voted in anyway.

If either Biden or Trump win the next election, they will be the *new* oldest president to sit in office",2023-11-15 02:27:09
Great Philosophical Catch 👏,2023-11-15 10:03:31
"It figures, coming from Twitter",2023-11-14 19:54:03
"Isn't it just saddening how whatever side you're from, it's always the normal civilians who suffer the most from wars, while the one who starts the war never ever gets injured...I just hope this war can end as fast as possible",2023-11-15 07:32:46
"They're shameless don't try to argue in good faith, mostly repeating common talking points from.their hasbara manuals.
 https://www.independent.co.uk/voices/comment/israelgaza-conflict-the-secret-report-that-helps-israelis-to-hide-facts-9630765.html",2023-11-15 04:43:38
Here’s another one https://www.instagram.com/p/Czo8n26K55T/?igshid=MzRlODBiNWFlZA==,2023-11-15 01:37:57
"There are only victims in war. No heroes. Its not a stage for heroism, its a waste of life. But this isn't a war. It's an occupation, and ending it will end the violence. Nothing else. Nothing less.",2023-11-15 08:26:38
"Yeah that's what I'm saying, I just don't think that innocent civilians from any sides deserve to die for the sake of politics, I hope people there can get well soon...",2023-11-15 18:22:38
"Only one side has been routinely bombing, displacing and terrorizing Palestinians for years. This wasn’t a peaceful co-existent that one day just abruptly ended. This was years of abuse and ethnic cleansing that was unceasing and relentless. 

One can truly admire the Israeli craftsmanship of systemically destroying an entire group of people and at the same times be completely terrified of how many years they’ve refined and honed their craft.",2023-11-15 22:20:29
"Oh come on, I'm not talking about the people who terrorise each other, I'm talking the ORDINARY PEOPLE WHO ARE JUST LIVING IN SOUTH LEVANT, what I'm talking is that they should not just die because of their own governments, they are just human like us",2023-11-15 23:16:01
"The Israeli people don’t care whether or not Palestinians get statehood, rights or representation as long as they themselves are safe and comfortable it’s easy for them to turn a blind-eye. 

On the other side Palestinians view the Israelis as occupiers instead of neighbors if given the chance and power they would most likely drive them out.

Advocates of peaceful co-existence are usually in the minority and are often ignored and disregarded as an exception.",2023-11-16 00:13:15
How long until it's deleted and then uploaded again without the Ukrainian flag?,2023-11-21 00:35:22
Couldn’t even blur out the Ukrainian flag 😹😹😹,2023-11-20 23:26:28
They really do steal everything,2023-11-20 23:27:44
They…they literally cannot stop lying. How utterly bizarre. I keep reading comments elsewhere that their social media intern must be pro Palestine because LMAO,2023-11-21 00:05:40
I feel terrible for not being a pro palestinian advocate sooner. I never knew it was like this. I. The US it is so common for kids to be groomed into believing Israel is a victim.,2023-11-21 00:16:33
"> 

> Honest people hate lies, but the words of wicked people are shameful and disgraceful (Proverbs 13:5).

> What are worthless and wicked people like? They are constant liars (Proverbs 6:12).

> A soothing tongue is a tree of life, but perversion in it crushes the spirit (Proverbs 15:4).

> Anyone who thinks and speaks evil can expect to find nothing good - only disaster (Proverbs 17:20).

> A false witness that speaketh lies, and he that soweth discord among brethren (Proverbs 6:19).

> A false witness will not go unpunished, and a liar will be destroyed (Proverbs 19:9).

> What is desirable in a man is his kindness, and it is better to be a poor man than a liar (Proverbs 19:22).

> If a ruler hearkens to lies, all his servants are wicked (Proverbs 29:12).

> There are those who speak like the piercings of a sword, but the tongue of the wise heals. The lips of truth shall be established forever, but a lying tongue is but for a moment (Proverbs 12:18 - 19).

> Lying lips are an abomination to the Lord, but those who deal truly are His delight (Proverbs 12:22).

> Wealth created by a lying tongue is a vanishing mist and a deadly trap (Proverbs 21:6).

> A false witness will perish, but the man who listens to the truth will speak forever (Proverbs 21:28).",2023-11-21 00:11:32
How are they so bad at this?,2023-11-21 01:35:25
"They found a staircase below Al Shifa hospital leading to a Swedish bunker, and aid for Ukraine stolen by Hamas. Nice job",2023-11-21 06:06:06
Can someone please document and save all the Israeli lies that has been refuted. Should be a main thread or something,2023-11-21 07:01:21
Also free Ukraine,2023-11-20 23:26:37
Oh my GOD!!! I've never met such repulsive compulsive  liars 😭 they just can't fucking stop LYING. Bro...they're like that one obnoxious kid in the playground that keeps lying and lying and lying abt unbelievable stories and it's so obvious they're lying but they still continue 😭😭😭and even if you tell them to stop lying they still do🤦🏼‍♀️,2023-11-21 04:39:43
they turned the Jordanian trucks back. It was reported.,2023-11-21 02:33:47
Zionist Israeli are the most wicked animal on the planet of the earth. They are born lier!,2023-11-21 03:11:24
"This has to be the most incompetent government propaganda attempt, right? 

They could probably make a fake set with all those billions they’re getting from the US.

Then again they don’t have to, because western boomers are either easily duped by Cable news and/or don’t care or about brown people.",2023-11-21 08:42:17
This is just pathetic.,2023-11-21 05:13:53
I can't believe they're THIS bad at propaganda,2023-11-21 07:52:28
"I can't believe somebody looked at this pic and thought ""hmmmmm.... looks good to me"".",2023-11-21 08:37:50
It's a Jordanian truck (look at the plate) with a Ukrainian flag sticker in support.  Cars around the world have Ukrainian flags in support.,2023-11-21 17:42:45
Why do they need to?  It has Jordanian license plate.,2023-11-21 17:43:51
"I think they live in the bizarro world, where everything is the opposite of what is said/done.",2023-11-21 13:35:25
They still think it's the 1960's where they can lie and everyone would believe them. Social media has been an effective too to dismantling their propaganda,2023-11-21 16:28:01
The only time 90% of Americans is not a full zionist nation is when social media becomes bigger than mainstream media. Hmm I wonder why.,2023-11-21 00:51:51
"The are committing crimes never heard of, stealing killed Palestinians body for their skin banks and organ harvesting. they kidnap them at gunpoint without any charge and torture and assault them in prisons",2023-11-21 00:35:37
"I've said since the start of this war that- it is tragic that it took a war to expose the Zionist murderers and thieves and their occupation of Palestine, running an open air prison, bottle necking millions of Palestinians into mass crowds nearer and nearer towards the border of Egypt. I'm glad that you and many others have begun to see who the oppressed truly are, the freedom fighters!",2023-11-21 01:57:48
"They're scrambling to cover up their war crimes. The entire world knows what they've done at al Sharifa hospital.

https://preview.redd.it/uo4c0z3ngn1c1.jpeg?width=800&format=pjpg&auto=webp&s=8f23257e0a321679b38d1c5f026faea1288bd4ff",2023-11-21 02:02:14
"I don't think they care at all. Because the US politicians are behind them no matter what. It almost looks like this is done on purpose. ""We can lie directly to your face and nothing will happen"". They're in for a rude awakening once the boomers are all dead.",2023-11-21 20:44:16
I second this motion. I think we should tell the moderators to create a mega thread of all easily proven lies by the Israeli government. Should be super helpful in messing with hasbara trolls.,2023-11-21 07:40:18
"looks like they doin ok, already giving back to the community",2023-11-21 06:16:36
Don't forget that kid is a psychotic bully also.,2023-11-21 15:14:18
They also banned Iranian aid trucks,2023-11-21 08:12:02
"Not to doubt you but source? I’m collecting a list of all proven Israeli lies so I can add it to the list. You don’t have to necessarily link it, just tell me where you saw it if you can :)",2023-11-21 07:38:25
"Man, nearly everyone across the western world hates boomers! Whether it's their blind support for Israel,climate scepticism, or hording multiple homes causing affordability issues...it's the same story everywhere.",2023-11-21 15:19:53
Could you explain what's wrong with the pic?,2023-11-21 20:32:04
"How well do you know Jordanian license plates? This pic is very blurry. Also, they would not have Ukraine flag without Palestinian flag or Jordanian flag.",2023-11-22 00:34:08
Nahh 💀☠️,2023-11-21 08:11:48
"israel times even, i cant remember tho. there is a video some where.",2023-11-21 16:20:51
Can't wait till the last one bites it,2023-11-21 20:45:33
"This was a Ukraine truck for Ukrainian refugees, Israel Hasbara claims its theirs for aids to the Palestinians Gazans which is a total lie.",2023-11-21 22:50:09
No worries I’ll check it out. And do you remember which platform you watched this video on? It’ll help me search.,2023-11-21 16:21:42
Desperate time leads to pathetic measures.,2023-11-06 13:01:58
"Better get all dolled up for your genocide selfies. 
Zionazi’s",2023-11-06 13:20:22
They’ve been doing this for a while. I’ve got a friend who’s pro-Palestine but did the birthright trip when he was younger and he said that the second you get off the plan you’re greeted by conspicuously attractive IDF soldiers. It’s pathetic.,2023-11-06 13:36:32
the fact that she’s a blue eyed blonde is painfully ironic.,2023-11-06 17:21:18
zionist psyop,2023-11-06 13:41:21
It's not new: https://www.rollingstone.com/culture/culture-features/israel-defense-force-idf-tiktok-thirst-trap-1174211/,2023-11-06 13:40:32
"they act like they worked hard for their current position of being the oppressor lol {as if its something to be proud of}. you can afford that stuff because the U.S. offsets your military spending and sends you high tech weapons to use against people who dont have any tanks or planes. zionists are fucking delusional, and pathetic.",2023-11-06 14:20:03
YouTube shorts is full of them. I tell them they will be more beautiful with a third eye in their forehead,2023-11-06 13:15:02
[removed],2023-11-06 14:28:58
"""rate my Halloween outfit"" 10/10, you look definitely like a modern colonizer.",2023-11-06 19:36:03
"your traps can't fool me, Satan",2023-11-06 15:01:03
Post hot girls It's supposed to make us more empathetic toward Israel? I really don’t get it.,2023-11-06 15:44:00
Im pretty sick to my stomach looking at this.,2023-11-06 16:24:07
"Imagine being forced to join the military, and then get assigned to operation thirst trap. Sounds like a 90s comedy.",2023-11-06 21:55:35
Pathetic🤔,2023-11-06 14:41:12
LMFAOOOO fr,2023-11-06 14:49:43
The virgin simping for genociders vs. the chad beating genociders to death with a folding chair,2023-11-06 20:29:24
Always has been.,2023-11-06 15:00:01
"Genocide for the hot babes!

Does this shit actually work?",2023-11-06 19:06:45
"This is a prey to a man’s weakness. Yes, I’d like to cum on your face, but not at the expense of another young child",2023-11-06 21:01:53
"Great strategy attractive white women, guns/military gear. Young men are extremely horny so it’s a good strategy",2023-11-06 18:45:11
The number of incels that'd fall for this is fairly high. That and racists. The fact that she's blonde and blue-eyed in by the textbook racist tactic. Only a pathetic shitheel would fall for this.,2023-11-07 02:51:29
Imagine being so desprate to make your soldiers post that shit so you can get more support to do more genocide 😂.,2023-11-07 03:44:35
Jews being dishonest and not forthcoming with the facts?! Color me shocked! This is exactly what the Hitler did with the Nazis!,2023-11-07 02:32:54
She would be a good hate-eff,2023-11-06 13:40:25
There on YouTube doing the same shit.,2023-11-06 18:50:04
[removed],2023-11-07 14:45:42
Remove the photoshop and FaceApp filter …. Everything is fake just like their made up country,2023-11-07 15:32:30
Remember when the CNN headline read “Israel at war”?,2023-11-09 15:59:51
"Birthright is all about pairing up participants with each other and IDF. That is how Ethan and Hila from H3 met, I believe. The whole goal is Jews marrying Jews , moving to Israel,and having babies to fight future wars",2023-11-06 13:42:36
They're all looking pretty Aryan as well,2023-11-06 15:56:24
as they say another aryan classic by the nazionists,2023-11-07 07:23:11
"that is hilarious lmao

or the 8th hole? maybe?",2023-11-06 15:06:20
No Support for Harm or Violence: Promote Peaceful Discussion. Read the rules for a better understanding.,2023-11-08 01:26:34
[removed],2023-11-07 02:45:24
[removed],2023-11-07 02:36:45
No Support for Harm or Violence: Promote Peaceful Discussion. Read the rules for a better understanding.,2023-11-08 00:17:58
Yup. He used to crack up when talking about how transparent it was. I don’t even think he was politically conscious yet when he went and he was still like “what the hell is going on?”,2023-11-06 18:26:10
"Garbage for garbage people, I guess.",2023-11-07 19:08:32
No Support for Harm or Violence: Promote Peaceful Discussion. Read the rules for a better understanding.,2023-11-07 06:37:55
Broad City did an episode about it. They got deported,2023-11-06 18:30:58
That sounds amazing.,2023-11-06 19:57:59
"I was afraid I’d cringe, but it was funny. If I remember correctly, they were deported right off the plane flying there.",2023-11-06 20:00:34
Gold medal in the genocide Olympics,2023-11-24 12:14:43
"Half a million children died in Iraq. Let’s not take away the crown. They deserve their recognition. The American murder started in 2003, not sure why you started in 2008.",2023-11-24 13:08:26
"Technically the resistance in Dune is the Fremen.  A distinctly Arab coded society.  Gosh, I wonder why Frank Herbert wrote it like that.",2023-11-24 12:27:59
All the while the greedy leaders laughing and enjoying luxury life whereas poor civilians like us got drafted to go fight the war they started.,2023-11-24 13:28:43
"168x Child kills / month of Russian forces in Ukraine.

0x Sanctions by G7 & EU hypocrites who only remember human rights and Int'l law when it serves their agenda.",2023-11-24 21:43:07
"Wait a minute, is that statistic comparing the rate of children killed in the concentration camps vs the rate of children killed in Gaza actually correct?  The Nazi rate being 127/day and the Israeli rate being 178/day? 

I ask because if this is correct, if Israel has actually *surpassed* Nazi Germany on a metric of absolute evil, the rate of the mass killing of children, that’s an incredibly significant event in world history",2023-11-24 22:56:23
And gold medal in mental gymnastics for anyone who tries to argue this is justified,2023-11-24 22:52:44
China is to NK as America is to Israel,2023-11-24 17:22:42
"[https://www.youtube.com/watch?v=1T5JRVR53Eo](https://www.youtube.com/watch?v=1T5JRVR53Eo)

  
 Albright was the first female US secretary of state and has helped steer Western foreign policy in the aftermath of the Cold War. She made the remarks during a 60 Minutes interview in 1996 when asked about the human cost of the US sanctions on Iraq following 1991's Gulf War.",2023-11-24 19:35:04
"That’s the grand total, and really the systemic killing of Iraqi children started in 1991 with the sanctions. 

I’m interested in the kill *rate* (whether annual or daily), whether it’s started with sanctions or the 2003 war itself, or whether it focuses in on the bloodiest timeframe",2023-11-24 23:07:59
Because most child casualties happen at the start of the war/invasion. We dont need to skew numbers to make this horrible so I hate when we see it.,2023-11-24 15:17:50
"I used to think the world would care about something like that too, but last month I was a younger more foolish person.",2023-11-25 06:01:54
"Is NK currently genociding a native population with the support of the world’s strongest nation?

don’t think so",2023-11-24 21:42:10
Who needs another population?  NK's government just oppresses their own,2023-11-25 01:33:08
China doesn't need anybody else to do their genocide for them. They're more than capable of doing it themselves.,2023-11-24 23:15:40
"Like NK or not they aren’t waging an active Genocide with the military and economic support of, and I say this again, THE WORLD’S STRONGEST NATION",2023-11-25 01:38:07
OK what exactly are you arguing against here,2023-11-25 02:03:12
Obligatory f**k zionazis.,2023-10-29 18:08:12
"Can we make a subreddit with all the people who were killed. We need to print them and put them all around the cities we live. In bus station, metro, supermarket, pharmacies etc, At least in europe or usa. People have to read and see beyond the propaganda in the media. Can someone help me do this?",2023-10-29 19:52:43
reading this was burtal,2023-10-29 19:13:29
why is palestine a watermelon,2023-10-29 18:54:25
There’s also the children of the man who was holding his children remains in two plastic bags screaming ( my children died) their names were Messa and Omar 💔,2023-10-29 20:32:50
Free Palestine,2023-10-29 20:58:32
There is no such thing as a good Israeli settler. All settlers are bastards.,2023-10-29 22:19:56
"Sometimes I feel these little memorials go a lot further than all the videos of brutality and violence we see every day. This shows who these people were, and what they had stripped away in an instant by the bombs of oppressors. Seeing these kids happy and full of life knowing they were murdered hits me a lot harder than seeing footage of dead bodies.",2023-10-29 22:50:14
"I cry everyday for the innocent of palestine. It's not fair or justice, it's sickening.",2023-10-29 22:31:34
Memorial etched this the names of every victim of Isreals genocide of Gaza civilians in the heart of Washington DC,2023-10-30 03:53:23
HasbiyAllahu wa ni’mal wakeel inna lillahi wa inna ilaihi yarjioon May Allah have mercy on all of the Muslim brothers and sisters and grant us all jannat il firdaws Allahumma Ameen,2023-10-30 09:54:35
"So fucking sad!! As an American I don’t condone this nor do I want our tax money paying for this… Dam anyone who’s allowing this to happen, I don’t want blood in my hands",2023-10-30 15:19:14
"May Hummus smite the children of Zion ,the sons of Satan.",2023-10-30 04:46:36
Agreed. All the zionists brutal victims' story must be documented and shared to the whole world.,2023-10-29 20:27:56
"Symbol for the Palestinian flag(red, black, white and green). Palestinians would use it when Israel made it illegal to display the flag publicly.",2023-10-29 19:00:33
Yes we need to show the world our humanity in a sea of dehuminization spread by the Zionist cancer and the western media,2023-10-30 06:21:26
Yea can we organize somehow?,2023-10-30 06:22:39
Interesting. Thank you.,2023-10-30 01:09:48
We need to get the source from the people living there. Who knows how many are left and how to contact them..,2023-10-30 07:28:50
